Game ID,Win,Word,Guesses,Strategy Mode,Pattern Progression,Strategy Log
aef80cc65c6c,❌,_ _ _ _ _ ,"i, e, a, o, n, t, l, r",,,
67168e1cc20b,❌,_ _ _ _ _ _ _ _ _ _ _ _ ,"i, e, a, t, s, n, r, m, c, o",,,
72ab97c0be05,❌,_ _ _ _ _ _ _ _ _ _ _ ,"i, e, a, t, o, n, r, d, c, l, f, b, s, p, m",,,
9efeb4dc95f0,❌,_ _ _ _ _ _ _ _ _ _ _ ,"i, e, n, m, v, d, s, r, l, a, g, o, w",,,
754669d97b0b,❌,_ _ _ _ _ _ _ _ _ _ _ ,"i, e, n, r, t, a, v, s, d, p, h, z, m",,,
fd75ee556287,❌,_ _ _ _ ,"i, e, a, o, s, t, n, r",,,
3ac4c5eef587,❌,_ _ _ _ _ _ _ ,"i, e, a, t, r, l, n, d",,,
aa6ceba23f01,❌,_ _ _ _ _ _ ,"i, e, n, r, t, v, p, d, a",,,
6185386415de,❌,_ _ _ _ _ _ ,"i, e, a, t, r, o, u, n, b, c, l",,,
5f70fb19c212,❌,_ _ _ _ _ _ ,"i, e, r, n, t, l, o, p",,,
bd8c7a50da7c,❌,_ _ _ _ _ _ _ _ _ _ ,"i, e, r, t, n, v, s, d, a, p",,,
6efd4124c7dd,❌,_ _ _ _ _ _ _ _ _ _ _ ,"i, e, a, r, m, t, n, h, d, c, l, g, o",,,
69161b00531e,❌,_ _ _ _ _ ,"i, e, a, n, t, g, l, d, r, m",,,
d1dd45fac0e2,❌,_ _ _ _ _ _ ,"i, e, n, t, m, r, l, s, h, a",,,
c2495af9c557,❌,_ _ _ _ _ _ _ _ _ ,"i, e, a, o, t, r, c, d, m",,,
d8c90d9bb3ce,❌,_ _ _ _ _ _ _ _ _ _ _ _ _ _ _ _ _ _ ,"i, e, r, t, v, p, n, s, d, a, g, o, m, h, l, b",,,
5b9f5e036d52,❌,_ _ _ _ _ _ ,"i, e, a, r, t, c, d, l, m",,,
2713dc9637b4,❌,_ _ _ _ _ _ _ _ _ ,"i, e, a, t, r, h, l, n, o, s, c, k",,,
92a58e54d76f,❌,_ _ _ _ _ _ _ _ _ ,"i, e, a, t, r, h, l, u, c, f, p",,,
8326c29d414c,❌,_ _ _ _ _ _ _ _ _ _ _ ,"i, e, a, o, t, r, n, s, c, p, m",,,
08d6aeeaa879,❌,_ _ _ _ _ ,"i, e, a, r, t, s, n, c, u",,,
2b8c253db09e,❌,_ _ _ _ _ ,"i, e, n, t, d, c, s, o, a",,,
61d345b68ad0,❌,_ _ _ _ _ _ _ ,"i, e, n, r, t, v, p, s",,,
394189d3499b,❌,_ _ _ _ _ _ _ _ _ _ _ _ _ _ _ _ ,"i, e, a, t, o, n, c, r, d, s, v, m, u, b, p, g, l",,,
9799d3184924,❌,_ _ _ _ _ _ _ _ _ _ ,"i, e, n, v, d, s, z, l, a, c, o, r, m",,,
d7d515cb23fc,❌,_ _ _ _ _ _ _ _ _ _ _ ,"i, e, a, o, t, r, n, l, v",,,
b7c2f315fd9a,❌,_ _ _ _ _ _ _ _ _ _ ,"i, e, a, o, t, r, p, n, c, s, m, b",,,
668c8002b897,❌,_ _ _ _ _ _ _ _ _ _ ,"i, e, r, t, n, s, a, c, l, d, v, p, z, u",,,
781bb1de9570,❌,_ _ _ _ _ _ _ _ ,"i, e, a, r, t, n, o, l, m, g",,,
8ba970de3133,❌,_ _ _ _ ,"i, e, a, r, n, l, t, m, g",,,
997b4834a905,❌,_ _ _ _ _ _ _ _ _ _ _ ,"i, e, a, t, n, o, c, l, r, s, h, m",,,
12af9d308efd,❌,_ _ _ _ _ ,"i, e, a, o, r, t, c, l, u, g",,,
7dd9115ee502,❌,_ _ _ _ _ _ _ ,"i, n, t, r, l, s, m, d, h, c",,,
e54e0287f1b8,❌,_ _ _ _ _ _ _ _ _ _ ,"i, e, n, v, r, a, o, s, t, d, c, u, p",,,
29657e80c23a,❌,_ _ _ _ _ _ _ ,"i, e, n, s, t, l, d, r",,,
5a55b027ab40,❌,_ _ _ _ _ _ _ _ _ _ ,"i, e, a, o, r, c, p, d, t, h, l, u, s",,,
498fe18926c1,❌,_ _ _ _ _ _ _ _ ,"i, e, a, o, n, t, c, r, h, s, k, l, d",,,
131af34c55f2,❌,_ _ _ _ _ _ _ _ _ _ _ ,"i, e, r, t, a, c, n, m, s, l, h",,,
faa054f38955,❌,_ _ _ _ _ _ _ ,"i, e, a, t, l, r, n, s, h, m",,,
4f14046a41c1,❌,_ _ _ _ _ _ _ _ ,"i, e, a, o, n, m, r, t, p, s, u, g",,,
ef01c95940fc,❌,_ _ _ _ _ _ _ ,"i, e, a, r, t, n, b, c, p",,,
a6842379c910,❌,_ _ _ _ _ _ _ _ _ _ _ _ _ _ _ ,"i, t, l, r, n, h, c, a, s, e, o, m, d, b",,,
aeb8e9ffdb9d,❌,_ _ _ _ _ _ _ _ ,"i, e, a, t, o, r, s, n, l, m, h",,,
ed52fe1e6f0d,❌,_ _ _ _ _ _ _ _ _ _ ,"i, t, l, n, g, b, v, a, r, h, p",,,
321a8f35bcd7,❌,_ _ _ _ _ _ _ _ _ ,"i, e, r, m, n, a, t, g, h, o, y, s",,,
53f4f41acec8,❌,_ _ _ _ _ _ _ _ _ _ _ _ _ _ ,"i, e, a, o, t, r, n, s, u, p, m, d",,,
6bd5af731501,❌,_ _ _ _ _ _ _ _ _ _ ,"i, e, r, m, l, n, t, s, o, a, p, b",,,
61098d606d86,❌,_ _ _ _ _ _ _ _ _ _ _ ,"i, e, a, t, n, o, c, l, s, r, m, d, v",,,
e76a232312e9,❌,_ _ _ _ _ _ _ _ _ _ ,"i, e, a, o, n, r, t, l, c, s, g",,,
354e714f8dde,❌,_ _ _ _ _ _ _ _ _ _ _ ,"i, e, r, n, t, d, l, c, m, s, a, f",,,
ee475427f5d9,❌,_ _ _ _ _ _ _ _ _ ,"i, e, a, t, l, r, n, o, s, c",,,
db74a706d965,❌,_ _ _ _ _ _ _ _ _ _ _ ,"i, e, a, o, n, t, l, r, h, m, u, s, d, c, g",,,
1d454ae85198,❌,_ _ _ _ _ _ _ ,"i, e, a, o, r, t, p, u, c",,,
1323a9a8fa33,❌,_ _ _ _ _ _ _ _ _ _ _ _ _ _ ,"i, e, r, t, v, p, d, n, h, a, s, c",,,
54b88fa9b2d4,❌,_ _ _ _ _ _ _ _ ,"i, e, n, h, g, t, r, o, a, s, b, l, m",,,
b2979d8f2f4a,❌,_ _ _ _ _ _ _ _ ,"i, e, a, t, o, r, n",,,
5bf93fd28fa6,❌,_ _ _ _ _ _ _ _ _ _ _ ,"i, e, a, t, n, l, c, s, o, k, z, r",,,
c2f25f1b537a,❌,_ _ _ _ ,"i, e, a, o, u, y, s, d",,,
8badd38e3801,❌,_ _ _ _ _ _ _ _ ,"i, e, r, m, l, t, n, a, o, v, p",,,
3f895706ab25,❌,_ _ _ _ _ _ _ _ _ _ _ _ _ _ ,"i, t, l, n, r, a, h, o, b, p, s, c, u",,,
ab2304ccdad0,❌,_ _ _ _ _ _ _ _ ,"i, e, a, t, n, r, l, s, h",,,
5f0a4eff21fd,❌,_ _ _ _ _ _ _ _ _ _ _ ,"i, e, a, o, t, r, n, h, l, u, p, c",,,
1125ade3049f,❌,_ _ _ _ _ _ _ _ _ ,"i, e, a, t, r, n, d, c, l, o, u, b",,,
b82e11afab60,❌,_ _ _ _ _ _ _ _ ,"i, e, a, t, c, r, v, p, d, h",,,
031c2583c0aa,❌,_ _ _ _ _ _ _ _ _ _ _ ,"i, e, a, t, l, n, m, r, h, c, s, d, p, b",,,
ee217a31b50c,❌,_ _ _ _ _ _ _ _ _ _ _ _ _ _ _ ,"i, e, a, o, t, r, n, s, l, h, d, m, u, c, g, f",,,
aa7290d3542a,❌,_ _ _ _ _ _ _ _ ,"i, e, n, v, d, s, r, a, h, p, t, m",,,
bac7be646e2c,❌,_ _ _ _ ,"i, e, a, o, u, y, s",,,
7e9290f21ab6,❌,_ _ _ _ _ ,"i, e, a, t, r, n, l, s",,,
bd3d17712079,❌,_ _ _ _ _ _ _ _ _ _ ,"i, t, l, n, a, r, s, e, c, o, d, m, g",,,
5cfb07fccf00,❌,_ _ _ _ _ _ _ _ _ ,"i, e, a, t, o, n, r, v, p, d",,,
a8682f9ea062,❌,_ _ _ _ _ _ _ _ _ _ _ _ _ ,"i, e, n, t, r, v, p, s, u, a, g, b, l, o",,,
020970e69df2,❌,_ _ _ _ _ _ _ _ _ _ ,"i, e, a, o, t, r, m, u, c, l, p",,,
d806d1d740f5,❌,_ _ _ _ _ _ ,"i, e, a, o, u, r, p, b, m, n",,,
3cef8ab62a57,❌,_ _ _ _ _ _ _ _ ,"i, e, a, o, t, r, v, p, s, d",,,
4764fd5b5ffb,❌,_ _ ,"i, e, a, o, u, y",,,
fd60e226acf1,❌,_ _ _ _ _ _ _ _ _ _ _ ,"i, e, a, t, o, n, r, s, h, c, k, d, p, g",,,
8880c0bf9a63,❌,_ _ _ _ _ _ _ _ _ ,"i, t, l, n, g, b, v, a, r, h, p, d",,,
88fb42024cb7,❌,_ _ _ _ _ _ _ _ _ _ _ ,"i, e, a, c, t, n, s, r, p, m, d",,,
0218c5a58902,❌,_ _ _ _ _ _ _ _ _ ,"i, e, r, t, n, m, c, s, l, h, g, p",,,
9cf0078edeaf,❌,_ _ _ _ _ _ _ _ ,"i, e, a, t, r, n, s, o, h, u",,,
28ec525a7eff,❌,_ _ _ _ _ _ _ _ _ _ _ ,"i, e, n, v, d, s, a, o, t, r, c, m, l, p",,,
744216ad1be3,❌,_ _ _ _ _ _ _ _ _ _ ,"i, e, a, t, o, n, r, m, g, l, c, h, b, v",,,
2d632152d25c,❌,_ _ _ _ _ _ _ _ _ _ _ ,"i, e, n, o, a, r, t, s, v, d, z",,,
73d5a7c751b4,❌,_ _ _ _ _ _ _ _ ,"i, e, a, o, l, t, r, m, p, c",,,
7a7a0513e70d,❌,_ _ _ _ _ _ _ ,"i, e, a, c, n, d, r, t, m, o",,,
3ced92419b7a,❌,_ _ _ _ _ _ _ ,"i, e, a, t, n, o, s, c, l, h, m",,,
67380d2ecc3a,❌,_ _ _ _ _ _ _ ,"i, e, a, t, r, n, s, p, w",,,
6f09b0097874,❌,_ _ _ _ _ _ _ _ ,"i, e, n, t, d, s, m, v, l, r, o, z",,,
fe01672405ca,❌,_ _ _ _ _ _ ,"i, e, a, o, u, y, s, d",,,
534818aa079f,❌,_ _ _ _ _ _ _ _ ,"i, e, a, o, t, r, m, c, p, d, h",,,
3dff4a5bd393,❌,_ _ _ _ _ _ _ _ _ _ _ ,"i, e, a, t, o, n, r, m, l, u, c, p, h",,,
0b4eb4a1df98,❌,_ _ _ _ _ _ _ _ _ _ ,"i, e, n, o, s, c, v, d, t, z, a, r",,,
8e9999459e09,❌,_ _ _ _ _ _ _ _ _ _ ,"i, e, a, r, t, s, o, l, u, n, m, c",,,
ecc56d45a1eb,❌,_ _ _ _ _ _ _ _ _ _ _ ,"i, e, n, v, t, a, c, r, m, o, d",,,
514a1308668f,❌,_ _ _ _ _ _ _ _ _ ,"i, e, a, o, t, r, p, u, s, n, d, h, c",,,
3e14ee492a51,❌,_ _ _ _ _ _ _ _ _ _ _ _ _ _ ,"i, e, n, o, s, t, a, r, h, m, l, v, d, z, f, b",,,
784955caf067,❌,_ _ _ _ _ _ _ _ _ _ _ _ _ ,"i, e, a, r, d, n, s, t, u, h, c, o, f, l, b, m, p",,,
1dbe7e1714c0,❌,_ _ _ _ _ _ _ _ _ _ _ _ _ ,"i, e, a, t, r, n, l, g, u, c, d, o, s, v, h",,,
bdde7eb7da7b,❌,_ _ _ _ _ _ _ ,"i, e, a, t, c, r, g, n, l, d, s",,,
